"review","sentiment","reviewer","score","type","stay"
"I don't know where to start, everything is just perfect and they showed you a true hospitality! Service was excellent, the staffs greet you everytime they see you. The room was spacious and so comfortable. And...breakfast! Wow they have so many variety of food and each of them were very delicious!   As a hotelier myself, I really amazed with Hotel Tentrem. What a great great experience. Thank you for your hospitality. :) ","Positive","rgpramasta",5,"Traveled with family","November 2016"
"I would like to say thanks for every staff here, they was give their excellent service to us. Saya sangat nyaman, bahkan sampe ga mau pulang you're success for made my feel like stay at my own home during I stay here. Once again, thank you very much and sukses terus buat Hotel Tentrem Yogyakarta. ","Positive","YohanesGema",5,"Traveled with family","November 2016"
"Excellent room, a little bit noisy if viewing the busy street. The staff is very courteous and smiling. Excellent bar with a cool temperature.  I did not try the swimming pool but definitely deserves at least a visit.  Excellent meeting rooms.","Positive","Alain P",4,"Traveled with family","October 2016"
"Stayed at Hotel Tentrem for 3 nights and it was an unforgettable experience to me and my family. Our room was upgraded from deluxe to premiere room. The room was very spacious with balcony and outdoor sofa. Perfect if you bring your children so they can run around. The hotel has a playground which is huge and lots of interesting playing equipment. The pool is huge and beautiful. Very cozy to sunbathing near the pool. The food, especially breakfast was awesome! It was really delicious and lots of choices. Love the welcome drink of beras kencur and kunyit asam by sidomuncul. Two thumbs up for the hotel! Everything is perfect i couldn't find the defect. ","Positive","R3Z4",5,"Traveled with family","November 2016"
"I dont know whether the location is strategic or not, coz it took 30 minutes of walking to malioboro and less than 10 minutes by car. Theres convinience market in front of the hotel along with small restaurants. If you go to the right the famous gudeg Yu Djum is only 5 minutes of walking, And there are restaurants too if you go to the left.  The hotel it self its luxurious, with huge lobby to welcome us. But the room and bath amenities is not that luxurious but still ok.  Breakfast is great, they have local food that you should try and they change the local menu everyday. They have many many many various item of bfast. Try the ""tolak angin"" ice cream if you like mint taste. Oh dont forget to take the sweet steamed bread too. They also have juicer so you could make mix fruit and…","Positive","gemilia",5,"Traveled on business","November 2016"
"Room is very spacious . The spa is recommended and is very relaxing. The swimming pool is really big and there is also a sauna. The breakfast offers a lot of options of different kinds of cuisines like Indonesian, Japanese,American etc.","Positive","jokooo",4,"Traveled with family","November 2016"
"We did our weekend getaway by travelling to Yogyakarta. My wife picked Tentrem Hotel, and as like other women in the world, my wife is always right, including choosing Tentrem Hotel.  She was asking for early check in possibility during online reservation when the hotel replied that they were not able to guarantee the availability of the room for early check-in.  On the D-Day we arrived very early, as our night bus ride was rather faster than it scheduled. We asked again whether or not we are able to get the check in at that early morning. The front-desk officer politely replied that the room is not ready. Only within minutes we realized that the hotel was fully booked, when we recognize at least three companies were having an event until that day...  Finally, at 0930 the front…","Negative","Arryo A",5,"Traveled with family","November 2016"
"Stayed in Hotel Tentrem for one night. Made a booking directly on their website. First impression, grande lobby and welcomed warmly by the reception. Traditional drink (Jamu) was offered as well. Surprisingly got upgrade from premiere room to executive stay. Room was very big, as well as the bed. Nice amenity kits offered using Bvlgari. The room was also include minibar and some fruits. Staffs were nice and polite, breakfast experience was nice also. They offer traditional indonesian, western and choices of fruit. Will definitely go back to this hotel again. Best hotel in Yogyakarta so far.","Positive","Aryudo",5,"Traveled with family","November 2016"
"Location is in the city centre but not in the business district or shopping area. It is close to tourists area. The hotel has calm and relaxing ambient since the first time you are entering the lobby. The property maintenance is good and very clean. Rooms are spacious and bed was very comfortable. mini bar items are F.O.C. Breakfast was fantastic with wide variety foods, drinks, deserts , could be the best in town. ","Positive","Michael S",5,"Traveled with family","November 2016"
"Stayed at hotel tentrem for two nights, from nov. 4 to 6. This is my second visit to the hotel. My first visit was last year and I had excellent experience, the hotel service and quality of food was fantastic. You can trully feel that javanese hospitality in this hotel. Something hard to find nowadays with modernisation. Unfornately, this visit was not the same. The service level has came down a bit. The special touches that made this hotel special is not there. The smile, greet and food selection was not as great as my last visit. I bet there is new management in the team or the good old team has moved somewhere else. Really wish the team can bring back the charm once again<U+0001F60A>. Well, overall this is still the best hotel in jogja.","Positive","Imanmarvel",4,"Traveled on business","November 2016"
"Overall a nice stay. Good size room and beds.  The quality of breakfast is excellent, especially the local food. Staff were generally nice and polite. We had a connecting room. The shower and toilet in one of our rooms need to be upgraded. I would have given a 5 if they had better maintenance of the bathroom. The pool and gym are very nice and large. I will stay there again when I am back in Jogja.  ","Positive","dattamimi",4,"Traveled with family","November 2016"
"YES! I love this hotel.   Nice design at the hotel room and lobby. Very artsy! I love the bathroom, and the bathtub and the amenities, the TV, the bed, the cleanliness and everything seems perfect! The swimming pool was amazing and clean! The hotel staffs were friendly and helpful. Also, the breaky was amazing! Amazing dishes! They were delicious!! I defo had an amazing experience and I would consider to be back!!  ","Positive","setiawaty n",5,"Traveled with family","December 2015"
"Our recent first stay in Tentrem was a delight in more ways than one. It is an imposing edifice, very tastefully designed inside and out with attention to both its impressive scale as well as the finest touches which make a luxury hotel what it is.  Rooms are spacious and well equipped, with wifi boosters in every room, which is a very thoughtful touch saving you from the hassle of unreliable room wifi.  Their Summer Palace Chinese restaurant is seriously good -- with authentic dim sum, Peking Duck, etc. The breakfast buffet in Kayumanis restaurant is lavish -- no wonder it's so popular even on weekdays!  Staff are very helpful -- particularly in the restaurants, even when they're about to close!","Positive","sakusa2016",5,"Traveled with family","October 2016"
"The room is very cozy and look so fancy. The use queen size bed for twin room. The interior of the room, the bathroom, and other stuff in the room is great. The give free minibar at your room.   The breakfast in Tentrem is like a feast, it's very delicious.   Eventhough the room is quite expensive, but I definately go back to Tentrem","Positive","Hazlina C",5,"Traveled with family","March 2016"
"This hotel is amazing, the room is so spacious and bathroom is lovely. Friendly staff and delicious food at the breakfast with many varieties.  There's also local boutique in the hotel lobby which is very good in standard ","Positive","Lisa R",5,"Traveled on business","August 2016"
"This hotel was recommended to me. I am so glad that i made this choice. The staff at this hotel go out of their way to make you feel welcome. The rooms are spacious and the corridors on one side have large bay window which has a view of Mt Merapi in the background. This is a lovely place for a family holiday. Thank you to all the staff for a very pleasant stay.","Positive","teacherteacher15",5,"Traveled with family","October 2016"
"The best part of the stay is the jacuzzi pool! and also the breakfast at kayu manis! the tolak angin ice cream makes you crave for more! Me and all my cousins couldn't agree more for deciding Tentrem as our favorite hotel, definitely will come back for another holiday here!","Positive","Anne H",5,"Traveled with family","December 2015"
"My 2nd time staying in this hotel, but the receptionist did not have my data in their database. Doesn't sound like a global operator. Room is big with 1 cozy king size bed that can easily accommodate 3 average size grown-ups, plus a long nice sofa where a person can also sleep there. Items in mini bar are included in price. Very nice amenities. Good breakfast selection, but not for lunch. But probably because not many guests stay in the hotel for lunch in this exotic city. Experienced at least a couple temporary electricity shut down in a day, but the generator immediately kicked in. Overall a nice hotel to stay if you don't mind the distance from city as the location is not near the city center.","Positive","Handojo S",4,"Traveled with family","October 2016"
"We booked online for 3 nights through the hotel website. Got special price with free minibar and laundry. Good value! Room and bathroom were spacious. Pool looks awesome although I didn't get a chance to use it. The only main concern is the bedsheet not clean. I don't think sheets were changed. Nice pool view by the way!","Positive","neonxxx78",4,"Traveled with family","October 2016"
"Stayed for one night during my business trip at Yogyakarta. When I first walked in to hotel, I smelled some kind of ginger aroma therapy, really relax, and they also served welcome drink. I stayed in double room with king bed size, the room is spacious.   Breakfast was good, they have various menus, from western to traditional food.","Positive","JakartaVic",5,"Traveled on business","October 2016"
"Hotel Tentrem is one of the best places to stay in Jogjakarta. It's best selling points are its magnificent building and common grounds and it's excellent staff. Despite its relative distance from the temples of Borobudur and Prambanan, as well as from Marlioboro street, the hotel is served by regular taxis and has a Golden Bird taxi & limousine service which is a reliable option to visit many places in Jogjakarta. The concierge staff were very helpful in suggesting places to visit and shop. I stayed in a deluxe room with a view of the city and enjoyed listening to the occasional morning noise from a nearby school. The room was impeccable and very comfortable and so was the bathroom. I used the beautiful swimming pool twice daily and it should not be missed in the evening. I…","Positive","Tarantella G",4,"Traveled with family","October 2016"
"Prior to the discovery of Tentrem, the only option for accommodation in Jogya was an upscale resort an hour away. Hotel Tentrem is a recently opened hotel in the heart of Jogya.  It is a luxuriously appointed hotel that provides the warmth of the Javanese culture.    Reservation can be done online. Airport pickup is an option provided by the hotel. Checkin was a breeze. Dining options are available inhouse - chinese buffet, barbecue buffet and others. Swimming pool looks inviting. Room provides a view of the Merapi. Executive lounge is comfortable This hotel puts Jogya high in my list of options for a short weekend getaway. ","Positive","amysa",5,"Traveled with family","October 2016"
"Tentrem is by far the BEST Luxury Hotel in Yogyakarta. Been here many many times and the hotel never fails to satisfy. Everything from the room, the service, the food, the hospitality, the spa, the pool, the children playground, the in-house store (selling up-market BATIK), in-house restaurant....are just PERFECT. During the last trip, I brought very special guest from Singapore and they TOO LOVE the hotel. Love the fact that's it's a COMBINATION of TRADITIONAL and MODERN. Every single aspect of the hotel has Traditional touch...from the standard Greeting (in Javanese Languange), the Jamoo Welcome Drink, the uniform of the staff, the traditional gesture including the ornaments displayed throughout the hotel.  Yet, the hotel still has MODERN and HIGH QUALITY standard... Special…","Positive","Yenella H",5,"Traveled with family","September 2016"
"Hotel Tentrem is now become my first choice whenever I visited Yogyakarta. The hotel interior, room size, service and location are all 5 stars. They have big playground for kids and also nice pool near breakfast area. Breakfast has ample selections of high quality local and international food which had included in the room rate. Their specialty is Tolak Angin ice cream which has very nice minty flavours mix with subtle touch of herbs come from Tolak Angin ingredients. Mini bar in the room is also free of charge.  The only flaw that I experienced were the fact that water pressure in the shower was not strong enough, encountered problem with hot water (which had resolved by hotel technician) an and unpleasant smell from the toilet. Should I didn't encountered these issues I'll…","Positive","JR01",4,"Traveled with family","October 2016"
"I stayed for 2 nights in August just for relaxing and getting away from works...and found the hotel was very comfortable......the food was good, the bedroom was big and comfortable, the smell of lemon grass aroma in every corner gave sense of relax.  The hotel is near some tourism objects...  I recommend you to put it in your hotel list when you go to Yogyakarta.","Positive","Irene J",5,"Traveled on business","August 2016"
"This is actually my second visit. The first visit was last year and I am looking forward to coming back to the hotel.  The hotel is still in very good shape, with luxurious lobby scented with lemongrass which gives fresh feel when you enter the lobby. The lobby is very spacious with high ceiling, giving a grand impression. This hotel is owned by Sido Muncul, so the amenities in the hotel (mini bar) carry a lot of their products such as the famous Tolak Angin, Kopi Jahe, Tolak Angin candy, etc.  The price of the food is quite decent, and the drinks are quite unique, for example they created Tolak Angin tea, and other mocktail with Sido Muncul products. The breakfast buffet is superb as it offers very wide selections of local (mie koclok, ketoprak,bubur Madura, etc) and…","Positive","Rianto H",4,"Traveled with family","October 2016"
"Second hotel we stayed at in yogyakarta and by far the best.  Very plush high end 5 star hotel and immaculate.  I'm surprised on the on line rankings this is clearly better than the rest.  This is 5 star by major city standard.  Superb gym better than most city club gyms,  lovely pool. Better choices of food than prior too. We had a very early flight and they up front offered to do a packed breakfast -  that rarely happens.    My only gripe would be the same as the rest of the city the restaurants are weirdly dead in the evening.  Hotel ran out of bottled beer even Bintang kinda odd.    I'd highly recommend this hotel ","Positive","Mark F",5,"Traveled with family","October 2016"
"Service: Service was excellent. Check-in and check-out process was quick and efficient. Employees was very welcoming and friendly.  Room: I was staying in junior suite room with executive lounge access. Room size was quite large and spacious. Room was very clean and tidy with Bvlgari amenities. Executive lounge was excellent with food, canapés, and a lot of alcoholic drinks as well.  Facilities: Swimming pool was very good  size and clean. Fitness centre also has complete equipment.  Location: Very strategic for the area. It is located close to city centre and attractions such as Tugu Jogja, Malioboro Street, and Keraton.  Breakfast: Good food selection with different type of cuisine. A lot of choice from healthy food to western and asian.   In summary, it was a pleasant and…","Positive","rustycorp",5,"Traveled with family","September 2016"
"Room is super comfortable, service is very good, you get Indonesian traditional herbal drink ""Beras Kencur"" as a welcome drink, and Sidomuncul products, like ginger coffee and herbal products for free in the room. There is also all you can eat yum cha/dim sum every Sunday that is very cheap, only Rp. 75,000 per person. Kids will also love this hotel as there is an awesome playground near the Chinese restaurant.","Positive","myfoodieguide",5,"Traveled with family","September 2016"
"Huge hotel building. We really love for every detail at this hotel. Pool side area was amazing, kayu manis resto was nice, food also was good, they offer many choice of foods on the breakfast with good quality. Room size was big, clean, with big window and big TV screen. Bathroom also clean and quite huge.  Staff give the service with smile. If you traveling with kids, this the best hotel with kids club facility. Cool!!! Overall, very recommended hotel in Downtown Jogja. My minor complaint only for wifi connection. Not to strong compared with other five stars hotel in Jakarta or Bandung. Good joob Tentrem Hotel. ","Positive","fajar248",5,"Traveled on business","October 2016"
"- The room so comfy with super wow bed, but one of the reading light unable to turned on. - They cleaned up your room twice a day (morning and evening), I dont know why, and always when I wasnt in room. - Never left you're money when you're out even just for breakfast. FYI, I lost some. - Friends tell me that 3rd floor is haunted. I was in 7rd floor, it was calm and nothing illogical thing happen.","Negative","Freakisha",2,"Traveled with family","October 2016"
"5 star hotel with luxurious and elegant design. The location is about 15 minutes from the Tugu. Once inside the lobby of modern and traditional nuances wrapped with interior luxury immediate. The loby spacious with marble ornament and solid pillars. Herbal spice fragrances make rilex. Staff were friendly, beautiful and handsome. The menu is varied and tasty food. I have not had time to stay at this hotel, just follow the meeting, hopefully next time I had the opportunity to stay here.","Positive","wike n",5,"Traveled with family","August 2016"
"The Tentrem is a delightful surprise.  Why?  It is a true luxury hotel in a small city, at which I would not have expected such high standards (with all respect due small cities!).  The sheer quality of this property, from its construction, materials, furnishings and everything in between, speaks of a no-expense spared approach, yet its prices are very reasonable - I paid around US$100 per night including tax, service charge and breakfast.  Even the staff are impeccably attired in various batik designs (depending on the department), and were all attractive.  The hotel is situated approximately 20 minutes' drive from the airport (double that in heavy traffic) and 10 minutes' drive from the Jalan Malioboro tourist strip - I am glad that I did not stay near there, because that…","Positive","Seat 2A",5,"Traveled with family","September 2016"
"A very Jogja 5 star hotel to stay for your holiday. Belong to SidoMuncul Group one of the famous traditional medicine company, from local become international wide.  I wont talk much abt their hotel spec quality. Just very acceptable 5 star one. But their service is the one to appreciate. Very into detail if not i say into perfection. Especially in their KayuManis resto during breakfast. It was crowded and acceptable if their staffs were tired. But their manager or captain (forgot to ask the name) was there to keep them maintain the quality even over a small thing. Salute.  And please keep it up. Cheers","Positive","Evan S",5,"Traveled with family","September 2016"
"luxurious. traditional. modern. classic.  this hotel gaining the good expectation from the guest. when I came, the atmosphere will bring you to somewhere, which is, it's not like in yogya. the material of this hotel really stunning. the concept they gave to me is something memorable when you got unique chocolate on hand. will be back to this hotel and recommend to the other colleagues.","Positive","Heytabitaann90",5,"Traveled on business","July 2016"
"It's a luxury hotel but need to improve more especially on staffs and breakfast menu. Room is quite huge with a bathtub and shower box, plus lots of amenities. We waited long for our baggage because it seemed that staffs are not that attentive. However, this hotel has a beautiful swimming pool and also kids playroom.","Positive","3zar",3,"Traveled with family","September 2016"
"A very modern, clean and central hotel. We stayed here for 2 nights with our young son and his grandparents. It was mainly a jumping off point for seeing Borobudur and Prambanan. We booked transport through the hotel and also ate most of our meals there (in the Chinese restaurant downstairs and in the hotel bar). It was a great place to stay with a toddler. Good sized rooms, lots of space to run around, great pool (incl. kids pool) and also a clean/modern soft play area within the hotel, with TV and other kids activities.","Positive","Victoria F",4,"Traveled with family","August 2016"
"Very nice hotel, nice ambience, quite a unique interior design. The staff were very polite and helpful. The room is spacious, modern, convenient.  The function rooms were nice, big restaurant in front of the Swimming pool.","Positive","Ario C",5,"Traveled with family","July 2016"
"Our stay of 2 nights is always memorable in this hotel. The rooms are clean and functioning properly.  Love the daily buffet breakfast with tons of choices.. fit for a ^sultan^   The service from the staff is always friendly","Positive","Natalina P",4,"Traveled with family","September 2016"
"One of the main things I look for in luxurious hotels other than room quality is the club benefit and this hotel offers the best club benefit in Yogya so far (Aug 2016) with all day free-flow beers. Some liquors, cocktails and wine will be available in the evening for an hour as part of the club benefits. It's great value for money if you drink alcohol.   For the executive rooms, the guests are pampered with amenities from Bvlgari. Bath salt also provided, sometimes upon request.   I stayed here several times, got room upgraded on my second visit. Thank Ms. Novita, the Director of Rooms, for her generosity.   My only complain will be the taxi service, which is third party company. There's always problem with its cars and drivers from too much questions such as ""What are you…","Positive","EmiAtria",5,"Traveled on business","August 2016"
"Hi!!!! I stayed here for a night in September. The Service is very very outstanding. The hoteliers are really nice and friendly.they deliver you to your room and explain about hotel 's facilities.  The room is very nice. Cleanliness is 9 of 10. the bath room nice too. it has a sofa too. The twin bed is really big...you can sleep two people in one bed if you want. everything on the hotel room is free. although the view is really not good one. Because I got room in level 2.  the facilities:  1. Kids playground : Very good. children can play as much as they want and you can watch them play while swimming.  2. THe swimming pool : very big and nice. because the swimming pool is between two building. the sun is not burning our skin. But the shower room for swimming pool is just one…","Positive","Irene D",4,"Traveled with family","September 2016"
"I'll start from the end, this is a great hotel.  The decor is a beautiful mix of Javanese art with modernity. Room is nice and big, with a balcony. The twin beds were huge and actually can fit two people in one. The gym is massive with a variety of exercise equipments.  You will also want to tick the breakfast option. With a very good selection of local cuisine, it is definitely worth it.  The only minor complaint is that the walls are very thin in the rooms; we could hear everything happening in the hallways and next door. ","Positive","harunjudin",5,"Traveled with family","September 2016"
"Stayed here for 2 nights, the service is outstanding, the room (we are family of 4) is spacious and great bathroom. It has a great swimming pool, and great breakfast. I can't say anything negative with the hotel. It was one of the great experience and one of the best hotel we have ever stayed.","Positive","Sylvia F",5,"Traveled with family","August 2016"
"Me, my parent and my sister enjoy staying here. Love the spacious bed (queen size twinbed), nice olympic size swimming pool and clean and tidy jacuzzi. Sauna also clean and neat. And their unique Tolak Angin ice cream and Ketan Hitam ice cream are so special and tasty. Will come back again someday for relaxing family trip","Positive","Chloe11369",4,"Traveled with family","August 2016"
