"review","sentiment","reviewer","score","type","stay"
"I have stayed at the Tentrem on several occasions and will never stay there again. Front desk staff have no idea about customer service. The rooms are noisy and delapidated. For example, no plug connected to the bathroom sink, leaking toilet and shower, paper thin walls so you hear everything in the next room. Maybe it was a five star hotel many years ago, but now it would hardly rate 3 stars.","Negative","Matt",3,"Traveled with family","December 2018"
"My stay on 9th December 2018 was my second stay at this hotel. The first stay was few years ago. I found that everything stays the same. Fast check in and the rooms stays as good as few years ago, also most important is very clean. Breakfast menu is good, many choices.","Positive","hasiu2018",5,"Traveled with family","December 2018"
"I stayed here for 3D/2N and got a great experience, especially for the room, choice of breakfast buffet and conference ballroom. The room was so cozy and luxurious, and so huge! The technology inside the room was superb, at least for me. On the TV screen there was a welcoming greetings dedicated to you (yeah, your name is there). Apart from choosing tv channels, you can also ordered room service using the menu on screen. Unfortunately A/C & light controls didn’t use this smart TV.  The room itself was lovely and could make you wanted to stay all day long. Breakfast menu buffet had so many options: from international dishes to traditional Yogyakarta/ Javanese dishes, including herbal drinks (jamu).  The conference room, which i spent 2 days here, was also great. Spacious, good…","Positive","Surjorimba",4,"Traveled with family","December 2018"
"Hotel Tentrem have a beautiful and interesting atmosphere that you can feel. The excellent hospitality, amazing culture of Yogya, delicious food and beverage, nice decoration, beautiful view and very clean, so you can feel very comfort to stay here.","Positive","Cahyo Adi N",5,"Traveled on business","December 2018"
"This is the best hotel I have ever stayed. All parts of this hotel are very fantastic. The atmosphere, the food, the staffs, the room, the playground .. very clean, very nice, and really enjoy it. Very recomended to stay at this hotel while you are in Jogja.","Positive","Fiji A",5,"Traveled with family","December 2018"
"I am personally very happy with the variety of javanese foods here. It takes me back to my childhood. The foods hardly found in Jakarta these days. Not to mention other international menu. Must try this hotel","Positive","Nia S",5,"Traveled with family","December 2018"
"Stayed on the executive floor at this hotel. Executive guests have access to the lounge for breakfast and happy hours. Breakfast is semi-buffet consisting of salad, fruits, pastries, and fresh juice and mains from a la carte. Staff at the lounge, especially Ms. Tika was warm, professional and most accommodating. Rooms are very spacious and curtains are very thick. One can have a good night of sleep.","Positive","Andrew_HKG",5,"Traveled with family","December 2018"
"True choice for who love modern, convenience, and traditional taste at once. I love the atmosphere when entering this hotel. Elegant and warm. Very Indonesia <U+0001F601>. And what I love most is the food. Come n enjoy","Positive","RitaRhoy",5,"Traveled with family","November 2018"
"It's my 1st review in the hotel and my first impression was very very good. The staff are super nice and kindly. The design of the room is very outstanding and comfy, and most importantly the breakfast is super worth it","Positive","Richard Lo",5,"Traveled on business","November 2018"
"It's my 2nd stay in the hotel, last time i stayed for the business workshop, this time with my family. The design is nice, once you enter the lobby, you can smell lemongrass aroma which make you feel calm & at home at the same time ('tentrem'). The room is spacious, the bed is comfortable, the towels and pillows are clean white. The breakfast is best at town, you can try Indonesian food with high quality (similar with the original taste). I like Kupat Tahu Magelang, and Tolak Angin ice cream. The location is in the central city, no traffic jam in front of the hotel. My kids love the children playground, they have a lot of toys and activity tools. The only cons was my wastafel leakage, so it get my bathroom always wet and slippery. Overall is very recommended and plan to stay…","Positive","Adrianus H",5,"Traveled with family","November 2018"
"Spoil the family and stay a couple of nights here.  This modern hotel has great amenities, including a spa with a wide range of services, that are all well-maintained.  The staff are very friendly and helpful such as when we wanted to hire a car and driver to visit Borobudur.  We stayed on the Executive Floor. The cost differential wasn’t high due to the special rates (including airport pick up) and the Lounge was very comfortable and a change of scenery from the room.  Highly recommend this hotel. Loved the pool & poolside bar service!","Positive","Spacecrew",5,"Traveled with family","October 2018"
"A magical pool ! Restaurant served wonderful Indonesian food but also western options. Accommodation very good but public areas stunning! Region has lots to offer and this is undoubtedly the best hotel in the region. ","Positive","Home71",5,"Traveled with family","November 2018"
"This hotel is very modern in town, compare to the hotel in the same level. Warm and homey room, equipped with sophisticated tools. The food are goods in terms of variety and the taste. All staffs are very friendly and helpful. I will be visiting here again, someday.","Positive","Dinanti E",5,"Traveled with family","December 2017"
"First time staying at Hotel Tentrem in Executive Room and I arrived at 3 pm (which is after the usual check in time at 2 pm). The receptionist said that it took 20 minutes for the room to be checked by the supervisor so she suggested to me to relax first and wait at the Lounge located in 8th Floor.   Here is the only problem I have with this hotel, at first I was drawn by how nice the staffs are; they were very communicative when I asked about best foods to get around etc. But then, the 20 minutes waiting time turned into 1 hour waiting time. It’s a bit of draw back there.   But overall, the room was nice and spacious with great breakfast served a la carte if you want to eat in the lounge and even request to bring the foods that’s served in the buffet restaurant.  ","Positive","Bianca S",4,"Traveled on business","November 2018"
"Good service,lokasi di tengah kota. khas jawa, every single thing is perfect. Big room,great restoran and tasty good food, Special thanks to Pak Ridwan yg membantu mengakomodir kebutuhan kami during we stay.","Positive","Connector24092929817",5,"Traveled with family","November 2018"
"Best hotel with great food, many facilities for kids and family, near from city center and comfortable room. The room are so big and luxurious even for a deluxe type and the breakfast are so many variant You can choosen.","Positive","Rico Mikhael",5,"Traveled with family","October 2018"
"I come here regularly for fitness, to see the female employees walk away from using the toilet without washing their hands are appalling.    Mainly these employees using the gym bathrooms work at the spa too.  5 star hotel employees?","Positive","Dina U",1,"Traveled with family","October 2018"
"Loved this hotel and the hospitality of the staff. We stayed in a suite and it was very comfortable and cosy. Our room had the view of Mount Merapi and that was a bonus for us! I absolutely loved the bathroom!  There was a good spread of food at the hotel for breakfast and I enjoyed their local coffee. Pool and kids club facilities were also good.  Its quite a luxurious hotel and I loved how welcoming and polite the staff were, anytime of the day!","Positive","Hanaz M",5,"Traveled with family","December 2017"
"I booked deluxe room directly through the hotel, asked the non smoking-pool view room and got exactly as my preference. I was impressed with the hospitality, service (its detail), and its ambience. Room's spacious and the bed was very comfortable. Free minibar with most product of Sido Muncul. Room service came twice in a day (they offer to clean the room in the evening as well). Breakfast was impressive with mix array of western and local cuisine and taste great. The pool was very nice (very inviting, big and suit for serious swimming), not too cold just perfect warmth. I don't try the gym facility though.   Well, there is a low down: can't access the wifi in the middle of the stay. The IT person came, try to find the problem. But ended up unsolved  Despite this problem, I will…","Positive","Dyahnastiti",5,"Traveled on business","October 2018"
"This may be the best hotel in town. It’s quite nice but in a standard way. The rooms were very nice but in an expected way. Food was good but not great. The service was a bit spotty. The desk staff was very helpful and polite but we had trouble getting a porter because there was a large group leaving. That’s fine except that no one told us that we would have to wait. Kids were in the pool at 6 AM screaming - not desirable if you have a poolside room like I did.","Positive","LARK70",5,"Traveled with family","October 2018"
"overall hotel service is below my expectation for luxury hotel. Thanks for spacious room and comfy bed. tentrem have various food choice for breakfast, but if you stay more than 3 days you'll find it boring.","Positive","Izani A",4,"Traveled with family","September 2018"
"I had been to jogja for the first time. The hotel was very big with all facilities including gym, spa, massage facilities. The rooms were quite spacious and had all the facilities including mini fridge with complimentry drinks. There is alfamart (convenience store) near the hotel. The hotel entrance was not impressive as it is besides a busy narrow street but inside the hotel was good.  Food had all varieties i.e. indonesian, western cuisine.the staff was helpful.the interiors of the hotel were standard as expected for a 5star hotel  Overall the stay was pleasant.","Positive","Priti C",4,"Traveled with family","September 2018"
"Having such great reviews online does create high expectations.  In short, Tentrem is probably the best hotel in Yogya in the eyes of locals. The hotel is beautifully designed with cleverly placed design elements, like on the balcony ceiling when it lights up at night. Staff were attentive and helpful.  The breakfast spread is a wonderful mix of local and western cuisines. The espresso shot I ordered ranks among the best I have ever had. Also check out the indonesian kopi nusantara coffee stand with an attendant who brews your cuppa on the spot; and the cart lady with juices and herbal concoctions.   Rooms are nicely decorated with the amenities of a decent 5 star hotel. The gym is well equipped and spacious; and the pool beautiful to behold.  However, there are areas that need…","Positive","Plxyz",3,"Traveled with family","October 2018"
"I stayed here because of running event in yogyakarta, i tried a boody massage there with my sister, they got a spa room for kids, they got a big room, gym roo., jacuzzi pool, small billiard table, nice and big food place.. very nice","Positive","Stefanus L",5,"Traveled on business","April 2018"
"still a nice hotel after all, the peopel are nice and friendly and so far all is fine. A couple things are not like before. room service . to pay almost 100.000 rupiah thats around 6,5 usd for a soto ayam without rice is wow expensive but still ok if the quality is top. thats not the case as it is with all the food actually. room service prices go up I believe 50% but the quality goes down more than that. breakfast is big but no taste of most of the food. western food is not easy to find and in bad quality actually. the baguett taste like a karton box. Yoga hotels just dont care about western taste so much as they have there domestic vitors, so no need. Breakfast in Bali is far better so thats why most visitors go to Bali or spend just a short time in Yogya and than go to Bali.…","Positive","kurt177",3,"Traveled with family","October 2018"
"I go there for the business trip on desember. Overall i like this hotel. I got the best rate with the good service. For 5stars hotel, this hotel has a cheap price. You get a free mini bar, a big room, complete facility and my favorite is the complete breakfast menu (Roti kukus is the favourite one). I enjoy my stay there. ","Positive","Lucia M",5,"Traveled with family","September 2018"
"This was our first time stay at this hotel. Is is located close to Tugu. Not far from airport and close to Tugu railway station. The lobby is spacious with beautiful interior and pool view.  Bedroom is spacious. I saw only 2 bottles of mineral water but minibar is free.  Breakfast:  Various food and drinks. Fried noodle : not bad Fried rice and chicken noodle were tasty.  Pastry : not special, ...ordinary taste.  Mung bean and other sweet traditional porridges were ok.  Wifi : Good but sometimes it's hard to send pics via WA.","Positive","Junsurya",4,"Traveled with family","September 2018"
"The hotel is fabulous, clean & grand. The room was spacious and affordable. House keeping was done twice a day and they give us free cakes almost everyday in our room. The gym is the best hotel gym i've come across. Well and fully equipped, spacious and clean. And they have an indoor heated jacuzzi. Unfortunately their sauna was under maintenance while i was there. Their outdoor pool also has an amazing view of the hotel and its big with beach bench, floats and good for photo taking! Breakfast buffet was a spread and we had dinner at the chinese restaurant. The food was really good for a muslim country. I heard from the staff that the chef is actually a chinese from Singapore! no wonder the food taste so familiar. Lastly, the staff service was exceptional, friendly and helpful…","Positive","Zen L",5,"Traveled with family","September 2018"
"Stayed here for pleasure & some business with family in last ramadhan season. Lobby was huge with some javanese ornament, really love it. Iftar buffet was amazing, you can find anything you want with very good taste as well. The only bit matter was distance from the main city, but as long as Grab can reach, it become doesnt a big deal. Will stay here for next visit to Yogya.","Positive","Travel818036",5,"Traveled on business","June 2018"
"Stayed in the Tentrem for a week and had a wonderful time at the property.  When you first enter the property you inhale at the majesty of the entrance and then you exhale slowly as you enter the lobby and experience a subtle opulent luxury that is culturally influenced in the design and furnishings.  The staff compliments the Tentrem's design in warm  welcoming smiles and greetings and and with their professional six star service.  My advice is to either have a car and driver waiting for you the airport or arrange the car service with the hotel, it's quite a bargain through the hotel and it's always nice to have great hotel service begin as soon as you leave the airport.    Once you get to the front desk you are still looking at how lovely everything is, especially the front…","Positive","John W",5,"Traveled with family","August 2018"
"This is our first time we stay at this hotel and totally not disappointed at all. The room is big, there is a sofa and coffee table inside, the bed is a king size (maybe enough for 2 adults and 1 children), the bathroom has separated toilet and shower, free mini bar, free wi-fi connection, international channel TV cable, and a balcony. The room was clean, the bathroom was clean, the staff was friendly. The breakfast is top notch! Many variety of foods, the taste and the food quality standards are also high for a breakfast buffet. Definitely one of the best breakfast buffet we have ever had in a hotel restaurant. The price also considered not expensive for a five star hotel with well equipped facilities for both the room and the hotel itself. Overall, it was a pleasant experience…","Positive","Abhirama H",5,"Traveled with family","February 2018"
"We were very impressed and happy as soon as we entered the hotel lobby..... spacious, grand, and with  a wonderful scent permeating throughout the lobby. We were also offered a drink while checking in. It was a very good first impression.   When we entered our room, we were more than satisfied. The room was a very good size and extremely clean with powerful air conditioning. The king-sized bed was wonderful, the room had a balcony overlooking the pool, there were a few complimentary drinks in the mini refrigerator, a sufficient selection of television channels, and bathrobes and slippers were provided.  I loved almost everything about the bathroom! First of all it was bright and spacious. There was a glass wall where one could see through to the bedroom and beyond but a privacy…","Positive","Marie B S",5,"Traveled with family","August 2018"
"A very good hotel. The room is huge and clean and the breakfast as well as service are excellent. Promotion price is also interesting. Suitable for family and group. Reception people are help full and friendly","Positive","Lilya L",5,"Traveled with family","August 2018"
"This hotel is amazing, love it! The room is huge and clean, as well as the gym.  The breakfast was amazing, they have everything from traditional food to western food. The staffs are nice and helpful. Very nice location too, near the train station and the famous Malioboro. ","Positive","M M",5,"Traveled on business","March 2018"
"Have a team outing in Yogya and so happy to stay in this hotel with a group of 30 peoples.  They give us a great service and they have a great view from our room. Their breakfast is excellent with various type of foods.","Positive","Yanna A",5,"Traveled with family","April 2018"
"Excellent in everything. A new hotel with big and clean room. Nice swimming pool. Breakfast is excellent with a lot of choices. The location of the hotel is also good, not very far away from the famous Malioboro street. On Sundays one of the in-house restaurants serves all you can eat dim sum (if you like it) - with a variety of Chinese food - for a discount price. Pay attention though, the price does NOT include drinks (tea, soft drinks, etc.)","Positive","GoodEreran",5,"Traveled with family","July 2018"
"This is the hotel that uphold their 5 stars title seriously.  The concierge team (pak Susanto, Dimas, Anggit, and everyone) help me 24 hours to find an oxygen rental for my father. All staff are friendly.  Their breakfast is the best and most diverse compare to all 5stars i've visited.  Spacious room and Great pillow.  You should try the ""tolak angin"" ice cream .   ","Positive","Yarra R",5,"Traveled with family","August 2018"
"Tentrem hotel is one of the finest hotel in Jojakarta, a city in Indonesia known for its culture. It is an elite hotel with a touch of tradition. Once you arrived the staff served you with classic traditional drink for the welcome drink. It tasted great. The room was comfortable and this hotel had a great chinese food restaurant downstairs. I really recommend it. I had a great quick stay at the hotel for my business trip. And surely will come back.","Positive","fennykamadi",5,"Traveled with family","February 2018"
"The hotel is great but what has impressed me are the staff's hospitality. in particular my appreciation to the front office staff, i think his name is Eka, good looking tall and kind. Incident was happened when i gave my cloths to be ironed by the laundry - i mentioned that i need them urgently. after waited and waited no laundry was returned. with panicked i tried to call and call that ended up got upset at the reception. the staff was politely assisted me by more calls to no avail. i returned to the room being so upset. minutes a knock on the door the reception man with my laundry..polite and kind the javanese hospitality.. this is amazing to me. he apparently run to the laundry and assisted the client to solve the issue. Things could go wrong in hospitality business, no…","Negative","49yoke",5,"Traveled on business","July 2018"
"I highly recommend staying at Hotel Tentrem when in Jogyakarta.  My family and I stayed at this wonderful hotel  in the Executive Lounge for 9 days and enjoyed the hotel's amenities and restaurants.  The rooms are comfortable, spacious and very clean.  The staff is wonderful, so helpful and genuinely so nice and friendly, from the concierge, front desk, room chamber, fitness centre, restaurant staff and the executive lounge staff.  We were impressed with the fitness centre as it was complete with all the gym equipment we needed to exercise.  Enjoyed the spa service and the products it had for our body scrub....lovely experience at the spa.. The chef at Kayu Manis provided amazing food selection for breakfast and dinners.  We enjoyed our daily meals at the restaurants and by the…","Positive","Ester L",5,"Traveled with family","July 2018"
"it is gorgeous! Apparently also mr Obama has been here because he visited Indonesia as a child and came back in last years. Hotel has spacious and clean room, great staff, nice pool, nice and elegant decor, good restaurants and incredible staff where the staff is incredible! I just had a message 1 hr / 21 euros and it was top. The area doesn’t seam to lively though and outside not so many places walk-in distance where to eat but in 5 minutes car (that hotel arranges) you can reach some nice restaurants.","Positive","camo81",4,"Traveled with family","August 2018"
"The best hotel in Yogyakarta. They have polite, quick and kind services there. They give very good breakfast especially i love their eggs, breads, and coffee. The room is very clean and comfortable, the hot water works very well. Pricey? Absolutely yes.","Positive","Jeffry K",5,"Traveled with family","August 2018"
"Located in central Jogja, this hotel provides luxurious accommodation and service, but with density population surrounded and limited land, not much view can be offered. Foods were good and service also nice. They served nice local foods (such as gudeg, pecel, nasi liwet, kupat tahu) in breakfast buffet. Perfect place for a short business trip, not for holiday. ","Positive","Rossa L",3,"Traveled with family","August 2018"
"It’s your luxury gateway in Yogyakarta. Starts with a super service at the check inn and goes through to all your stay. This hotel offers you big rooms, a rain shower in the bathroom, a balcony and the mini bar is free for use.  The breakfast choices are Indonesian, European and American, they offer even ice cream for breakfast. The pool area is located at the breakfast area, on the lower level. A big pool invites you for relaxing and for all parents, there is all the time a lifeguard so no worries for the kids going for swimming.  From the hotel location you have a good access to the city centre and it’s heritage but also to the airport and the heritage sites around Yogyakarta.","Positive","BenNurVei",5,"Traveled on business","July 2018"
"Stayed in this Hotel for four nights with my wife and little daughter. Superb hotel, I consider it not a 5 star but as a 6 star property. Great decor, brilliant food and fantastic staff members. One incident that I will remember for long, e.g. the day we arrived at Jogja was my daughter's 4th Birthday. The authority of the Hotel presented her a lovely Birthday cake and a nice family photograph taken on that particular occasion. Hope my daughter will remember this incident throughout her life. The behaviour of all the staff members were so polite and we felt they are very familiar to us. Indeed we had a wonderful time in this hotel and so giving Hotel Tentrem, Jogja a very strong recommendation.","Positive","Partho_66",5,"Traveled with family","July 2018"
"Very relaxing spot in the morning and afternoon. You can sit on the lounge, facing the pool and enjoy their delicate foods or snack or just grab beers and chips. Try their “Nasi Gori” and “Nasi Campur Dendeng Gandik” for lunch. They’re lovely.","Positive","Hans",5,"Traveled with family","July 2018"
"We really enjoyed our 3 nights here. The room was large and very comfortable, the breakfast buffet was excellent, the service at every level was friendly and sincere and the lunches and dinners in their Chinese restaurant were very, very good. All for a price we felt was quite reasonable. They helped us with a day trip to Borobudur and offered the option of a shuttle into the historic district (in any event taxis were a bargain).","Positive","Randonne",5,"Traveled with family","June 2018"
"Hotel Tentrem is one of the five star hotel in Yogyakarta. We stay here 2 nights for friendly vacation. The price we've paid was worthed.  This hotel located in the strategic street, not too far from Jl Malioboro (on of famous street in Yogyakarta), comfy and very big room, also have complete facilities  As we enter the lobby, it welcome us with fresh fragrance of lemongrass like smell and, warming ambience. You can find replica of beca there (traditional transportation with 3 wheels),  For the bathroom, with bathtub and separated with glass (it have curtain) from the room.  Swimming pool in the ground also one of the entertainment here and if you happen to be in the hotel by night, you can enjoy light music in their lounge.  The hall for breakfast is big, but sometimes it's not…","Positive","Melani M",4,"Traveled with family","July 2018"
