"review","sentiment","reviewer","score","type","stay"
"I stand guilty of sloth - I stayed at the Tentrem last year and while I sent them a 'thank you' note soon after, I neglected to post my experience on TripAdvisor. Here is what I wrote to them verbatim:  "" I am late in sending this mail - my apologies. I had the pleasure of staying at the Tentrem from 10th to 14th of June and I must congratulate you on the efficiency and attentiveness of your staff - the quality & comfort of the room and the courtesy that was shown to us. I must make a special mention of Chef Manarata who went out of his way to ensure that I got a good vegetarian breakfast everyday of my stay - he is a real asset to your hotel and just one of the reasons that I will come back and stay with you whenever I am in Jogja. Thank you very much.""","Negative","Pankaj Sharma",4,"Traveled with family","June 2014"
"A brief stay in Hotel Tentrem for a meeting. Overall experience : spacious room, free minibar, touch of luxury around the hotel and courteous staff. Yet they lost logistic for the meeting that we sent directly to the hotel and failed to respond properly for our request to track the delivery. Pity for such hotel to invest on luxurious stuffs more than customer oriented approach by the staff.","Positive","seisar a",2,"Traveled with family","January 2015"
"Just like the name of the hotel, Tentrem. It feels so homey staying there. You will enjoy all the environment just by staying at the hotel itself. Did enjoy the swimming pool, the gym, and of course it has the best indoor tennis court. And my son who is 3 years old also enjoyed the play ground. So that I can have quality time for my self. The staff also very nice, helpful and also very polite. And yet don't mention about how spacious and luxurious the room is. Did enjoy the whole 3 nights staying in Tentrem Hotel. Oh ya, the Ballroom is just one of kind. Never seen any ballroom like this before. Will definitely coming back here again.","Positive","Wynne81",5,"Traveled on business","December 2014"
"I love this hotel! We stayed in a Deluxe Room. Room was spacious, beautifully furnished & styled, and bed is so comfortable. My room did not have much of a view, but got plenty of natural light. Service is outstanding, from concierge, front desk, room service, they were all friendly and courteous. A few days after checkout I realized that I left behind a piece of clothing in the room. They responded quickly when I inquired about it, and the process of collecting it was very easy.   Room service is pretty good; selection is limited but the ones we ordered were all very tasty and are reasonably priced.  The only downside is that the minibar fridge was not cold at all, so I couldn't save my baby's leftover baby food for later. Overall, this hotel is excellent. Will surely stay here…","Positive","melly192",5,"Traveled with family","September 2014"
"Tentrem is a great value for money hotel, the property is mantained painstakingly and it shows. the rooms are spacious and very clean. The breakfast spread is very good too. And the gym is one of the best i have seen in a hotel. Overall its always great staying at Tentrem. For those of you who like massages, its got a very good spa with professional masseurs who do a damn good job and because its jogja its great value for money.   I always enjoy staying here","Positive","SamaIndia",5,"Traveled with family","March 2015"
"Contrast to its rather conventional name, Hotel Tentrem provides a luxurious, unique, and exciting experience. The time I spent in this new but extraordinary, luxury but culturally relevant, and unpretentious but naturally eye-catching hotel was among the most prominent one throughout my traveling experience. The architecture and lobby decoration were designated in a deluxe and modern style, yet it still radiates friendly and Javanese culture warm-like atmosphere. In term of cuisine, Hotel Tentrem provides a fabulous typical Asian dishes. My culinary experience at Kayu Manis, an Indonesian restaurant with fascinating Javanese-like atmosphere, and Summer Palace, a decent and deluxe Chinese restaurant were not disappointing at all. The regular king-size type room was decorated in…","Positive","Gilbert S",5,"Traveled with family","December 2014"
"I have been traveling to Yogyakarta for the past twenty years for both business and pleasure.  On a recent business trip I researched places to stay and chose the Hotel Tentrem.  My business partners and myself were both amazed and delighted to discover that Yogya has an exceptional 5 star property with service and amenities that are world class.  It is evident from the moment you arrive that the hotel was planned with meticulous attention to detail.  There is a welcoming graciousness and ease that you find only in the best properties - a quality that makes for a truly delightful stay.   While contemporary in design and execution the artistic heritage of Yogya is evident from the room appointments to the staff uniforms.   A unique welcome drink of authentic Indonesian Jamu was…","Positive","TaksuBali",5,"Traveled with family","March 2015"
"When I first heard of its name, I do only expect an ordinary typical local Hotel...However, it surprised me as I entered the Hotel main Lobby, I could only see a very modern and luxurious Hotel, attended with a warm and very professional staffs...and it is in Jogja.  I was greeted with a friendly staff whom offered me with two choices of exquisite traditional drinks, which I can only find in this Hotel....As I enter the room, I was even surprised as the room was very beautiful and equipped with the latest high end equipment.  What I like about this Hotel, it always tried to combine a Modern with a traditional touch... The soothing Javanese Gamelan in the TV Welcoming Menu,  in-room ""ginger-tea"" traditional welcome drink served in a traditional tea-pot set, it reminds me that I'm…","Positive","Ivan_Sutanto",5,"Traveled on business","March 2015"
"If you seek for modern hotel in traditional ambience, this is the right hotel. For the price for 5 star hotel, it worth for every penny....wide room, and modern facility, and you can have lunch or dinner at Duck King (chinese restaurant) in their hotel. They have good sauna, whirlpool, fitness center and swimming pool with the best facility.","Positive","risk4",5,"Traveled with family","December 2014"
"The hotel is new and near the city center (15 minutes drive to Malioboro). I booked 2 rooms (1 king size & 1 twin bedroom) which is US standard size bed (which is larger size than typical Asia & European standard size) which is a plus for me. In addition there is sofa bed on each room, which is good if you receive guests and you don't want your guests to sit on the edge of your beds. The room area of around 40 meters is spacious enough and there's even balcony facing swimming pool. Try the pretty swimming pool decorated with mozaic on its base at 7.30 am - what a pleasure. But after 8.30 the you will thoroughly baked yourself, so limit your swimming time until 8.30 am. If you don't feel to swim, you can go to the gym's modern and spacious sauna & whirpool (free of charge as…","Positive","Slamet Gunadi",5,"Traveled with family","February 2015"
"I stayed in Tentrem hotel during company's 3 days conference.   The hotel was big,luxurious decorations,and gives 5 star hotel experience.  The room was also nice, although I got the corner room.  Breakfast selection menu was OK, with a wide range of selection. They even have this unique desert called ""Es krim tolak angin"". Definitely must try!  The pool seems nice though, but haven't got a chance to try because its located near the restaurant. Makes me feel a bit uncomfortable.  Our conference was held in the hotel Ballroom,which is located on the other side of the building. There's a tunnel that connecting between the building, but the Air Conditioning was a bit hot and the area needs to have air purifier.  The internet connection was OK, although you have to re-login after 1…","Positive","Dhanty P",4,"Traveled with family","February 2015"
"Nice, modern and clean hotel with very courteous staffs. The biggest downturn for me, unfortunately, was the thin walls. At night you can hear the neighbours pulling in/out chairs, watch the TV or just people talking down the hallway. It's a real pity because everything else was great.  The bed was comfy, room spacious and clean. Breakfast had very good selection as well. I didnt try much of the western food, but their Indonesian menu was authentic and hearty.   Location-wise, the hotel is about 30-45min away from the airport, depending on traffic, and about 5-10min drive from Maliobori shopping district.","Positive","lil_tabi",4,"Traveled with family","February 2015"
"Opened in 2014, Hotel Tentrem truly deserves its top spot when it comes to Yogyakarta's hotels.   Hotel Tentrem offers a unique blend of modern luxury amenities, five stars facilities and warm traditional Javanese hospitality. Cleanliness is well kept throughout the hotel, while staffs service and friendliness are top notch.  Other thing worth mentioning is how kids friendly this hotel is, from dedicated kids center, spacious low level pool area, and kids-dine-free offer in its buffet restaurant.  Yes there are few imperfections such as how the free internet connections are limited but I truly recommend this hotel to anybody looking for a pleasant stay in Yogyakarta.","Positive","RyanWira",5,"Traveled on business","February 2015"
"Pleasant hotel and rooms and facilities all good and as you would expect but the food options are poor especially in the main restaurant where the options were very limited and food standard below average.  I was at a conference for the week and the food at the breaks was just weird, my favourite was the cheesecake with grated cheese on top!  The Internet was also really poor with everyone on the conference complaining about connection reliability and speed.  All round disappointing.","Positive","InvisibleMan22",1,"Traveled with family","February 2015"
"I stayed at the Hotel Tentrem as part of a tour of central Java.  I was away during the day time hours, so I did not get to use the pool or exercise facilities, but they looked quite good.  The breakfast was good, and the Chinese restaurant in the hotel was excellent--so good that I ate there twice. The staff was very good and helpful though the conceirege desk did not have a great knowledge of things around the hotel. Maybe it was the questions I asked, and not they.","Positive","Phil from Golden",5,"Traveled with family","January 2015"
"This hotel is very suitable for family with big bed and additional sofa (for kids), and there's a big playground (big for a hotel), and superb breakfast with many choice. I will recommend this hotel to everyone.Will be back soon :)","Positive","Ivone78",5,"Traveled with family","December 2014"
"i stayed there on May for couple days. staying in their standard room which is very very comfort and cozy, the room very huge and everything is so big and i think its worth it with that amount. the staff very friendly and they give nice service during our stay.","Positive","deaboet",4,"Traveled with family","May 2014"
"This is by far the best Luxury hotel in Central Java, a wonderful place to stay and venture to all the sights.  Free shuttle to Moliboro, outstanding Executive Lounge on 8th Floor staffed by Aaz, he was super!  Even the owner of the hotel, Irwan Hiidayat, visited with us in the lounge.  His family runs the Jamu company, Sido, which there are free samples in the room.  Also the room has a free mini bar, free pressing and a great fitness center. The Spa is spotless, well managed and truly enjoyable.  The staff arranged our golf outing at the volcano Merapi golf course and our day trip to the Borobudur Temple including lunch at a local eatery. Our suite was superbly decorated, with a beautiful bathroom and floor to ceilings windows that had a fantastic view of the active Merapi…","Positive","Demill",5,"Traveled on business","January 2015"
"Yes, the hotel is new, beautiful and well kept with lovely staff and good value. Spouse and I stayed in premier level room.  But   ---- :  Hotel is sited in downscale area where walking at night could be dangerous.    Design esthetic prevails over guest considerations ---  privacy screen between bath and bedroom is porous so light passes through glass partition to illuminate bedroom at night;  shower door opens inward, so you must enter shower to turn water on, thus being doused with cold water. To avoid having your hair wetted bring your own shower cap, as none is provided. Water controls are near cylindrical  polished metal and impossible to turn with wet or soapy hands.No clothes drying line. No tub,  ""modern""sink, without stopper, is designed to prevent water overflow, so…","Negative","wrantar",5,"Traveled with family","January 2015"
"We (me, my daughter in law, & nephew) stayed at Tentrem last week (24-26 January 2015). This hotel is very comfortable, clean, the employee is very nice. We stayed at the premier room with pool view. Love this room. But so sadly, this hotel have no salon for hair service (hair blow). They just have a spa service. The breakfast for me is so-so, under my eexpected for five stars hotel :(","Positive","Chubbynduth",4,"Traveled with family","January 2015"
"I stayed at Tentrem on Dec 14 when my company held a conference the.   It was my first stay there and boy it was a pleasant one! I've got a king size bed room sharing with one of my colleague - as the hotel run out twin room (because of my company event). The room size were B.I.G! the bed was very comfortable and they have a big sofa near the big window for us to just sitting around..  the bathroom - they have separate toilet and rain shower - with complete amenities. no complain there.  Breakfast (also lunch & dinner) was okay. not WOW - but acceptable.   Pool area - it looks nice but I didn't jump into the pool as I'm staying there on business purpose.   Kids club - I saw a big room with a big playground area next to the pool, it was a playground that my kids would love - so…","Negative","aldarani",4,"Traveled with family","December 2014"
"We enjoyed our stay at the Tentrem Hotel Yogyakarta. Kids enjoyed their time in the kids club too. The room is big, comfortable and very clean.  The staff are all very friendly. The breakfast is amazing, a lot of variety 'till we can't decide what to have first :) We love it.","Positive","Liza_Twin",5,"Traveled with family","May 2014"
"I really love this hotel. The employee is very nice, always smiling. The room, is very huge, and nice. I stayed at the premier room. The breakfast is very delicious. The taste of the bread is very good. It's as good as the one I bought a cafe. The salad dressing, homemade, and matched with the salad that I ate. I think I agree that hotel tentrem is the best hotel in 2014 in Yogyakarta.","Positive","AgungTan",5,"Traveled on business","January 2015"
"I just spent my 3 nights vacation in Yogya last week (17-20 Jan 2015) I booked this hotel for 1 night only, because I have to join our family reunion in other hotel for another 2 nights. But when I arrived in other hotel (I booked suite room at 3 stars hotel), the hotel was not so comfortable as Tentrem, so I decided to go back and book for another 2 night. The hotel is really 5 stars hotel, the lobby & lounge is grand. The WIFI is fantastic. The breakfast was very good. Location also very good. This hotel is very recommended to stay when you are in Yogya.","Positive","Indonesian-Jetset",5,"Traveled with family","January 2015"
"I heard a lot of good things for Hotel Tentrem and I certainly agree when I finally stayed there with my family prior to Christmas last year. This hotel can provide a baby cot for no additional cost. Room was really clean, combined with the modern interior design, it makes me want to sleep longer. The facilities available at the hotel were just superb. You can simply take any beverage in the bar fridge in your room absolutely for FREE! The gym was spacious and equipments are new. This is truly the 1st class hotel. Service, food,cleanliness all ticked the 5 star requirements. One word: Exquisite. Don't go anywhere other than TENTREM!","Positive","Ricky C",5,"Traveled with family","December 2014"
"I love my stay in the hotel :) We are welcomed with Jamu (traditional herbal juice) welcome drink. For you who have never try jamu, it is a traditional herbal drink that is believed to help maintaining health and beauty of Javanese people from generation to generation. Instead of air freshener, the hotel use heated aroma therapy oil. The staffs are kind and very helpful. The room is clean and have all standard requirement for a hotel room in such level. We have a bit of a trouble with the wifi though. Only one device can use the in-room wifi at one time. The swimming pool is great and the spa is high in demand (so high that we have no chance to try it; it is fully booked). The breakfast and dinner were OK. They also provide shuttle to Malioboro which is great since it is located…","Positive","450Paddington",4,"Traveled with family","January 2015"
"Tentrem is Javanese for tranquil.. the hotel is newly built only 1 year into operation.  the interior is a combination of classic and modern minimalism with local accents.  it's clean, comfortable, and the mini bar is free and is generously supplied, so are the bath robes and the slippers are available.  The room is well lighted and equipped with the state of the art HD TV.  Since the hotel owner is the producer of the famous jamu 'Tolak Angin', the coffee and tea provided in the room are all given with the 'jamu'  (Javanese herbal) twist, such as Kopi Jahe (ginger coffee), kunyit asem (turmeric and tamarind juice sachet) etc.  For the foreigners, these might be something to explore as there is no Nescafe sachets provided.  The breakfast comes free and is truly an extensive…","Positive","Ritaksm",5,"Traveled with family","January 2015"
"Awesome hotel, 4 thumbs for it. Good place,  good food, luxurious room. But when b'fast have queue it takes time to wait. Have only one in the world : ice cream tolak angin, delicious ice cream and unique. You have to try it. Never found that ice cream.","Positive","Denny S",5,"Traveled on business","January 2015"
"Stayed at Hotel Tentrem last October 2014.  We had a great experience.  Staff were friendly.  The concierge was able to assist us to our visit to Prambanan.  The pool area is fantastic.  If you don't want to spend on hotel food, they have Duck King.    Will definitely consider staying at Hotel Tentrem again on our next visit to Jogja.","Positive","mymakeupstudio",5,"Traveled with family","October 2014"
"Recently finished my trip to Jogjakarta. I was referred to this hotel by my senior manager since he said it was 5-star hotel in Jogjakarta. A little bit skeptical at first but I tried this hotel anyway. I would like to thanks Christie-DOS for helping me with my reservation.  Arrived in the hotel I was greeted nicely though the security didn't check anything on me since I was going in the hotel by myself. Greeted by Nesya upon registration, but the room was not ready at the moment (around 4 pm). After finishing the registration, I went to the parking lot under the newly-made Ballroom. A little bit far from the hotel but it was nice since you can use a bridge that connects you from the ballroom to the hotel main lobby. Went back to the reception to collect my keys, I was handled…","Negative","gegeWdj",5,"Traveled with family","January 2015"
"We were picked up by the hotel staff at airport as i have specifically requested for airport pick-up. They provide avanza (smaller) and innova (larger) van. I choose innova due to the number of luggages i had, and the size of my family. The driver is very helpful, and in the car, they provided welcome box with towels, candies, and so on.  The check in process was pleasant and a breeze, we were provided with welcome drinks traditionally made javanese (i.e. gula asam, beras kencur). It was refreshing, and the staff was very friendly. The hotel is brand new, and they will have grand opening in Jan 2015. I heard it is owned by Sido Muncul.  We stayed at the Deluxe room, where they provided with 2 queen beds, which is perfect for my family of four. However the bed is quite hard for…","Positive","Ferry Mulyadi",4,"Traveled with family","December 2014"
"Always the wonderful feels even after my 4th stay at this hotel. From service to facility, I found them flawless. My family loves Tentrem Hotel. Nice beds, big bathroom, huge selection of food at breakfast. Room rate is pretty reasonable with such extra points they have. I would definitely go back here at my next trip to Jogya!","Positive","Evy S",5,"Traveled with family","December 2014"
"Spent one night here to visit the Borobodur and Pwmbranan Temple complexes. The hotel was quite new, the rooms were very modern and clean. Staff was attentive and courteous. No hesitation about staying here. ","Positive","URSOJS",4,"Traveled on business","December 2014"
"I stayed for 4 nights in the hotel and the experience was one of a kind.. - The service offered was above my expectation, they even sent me back the USB Flashdisk that was left in my bed just two days after my checkout date. - The atmosphere around the hotel is so chilling, best for us who wanted to relax. I especially loved the aromatherapy used in the passageway and the public restroom.. was so relaxing - The facilities were outstanding.. the jacuzzi is so spacious, the swimming pool is good enough for us to burn some calories, the gym is hi-tech - The room is what a five stars hotel standard room should be. Hi-tech, spacious and the bed was so comfortable.   The only average score might be given to the food aspect.. the taste was pretty much very average but somehow the…","Positive","Hasya S",4,"Traveled with family","December 2014"
"Big property, big room, big pool, well everything about construction are big.. even from the outside you will find big pillars..you might consider to bring your own otopad  as bicycle for outside building activities and they provided for free.. you will admire the beautifull javanese style design interior as also surprise there are ""bemo""  that been used by our president during their campaign.","Positive","arthur b",4,"Traveled with family","November 2014"
"One of Yogyakarta's newest hotels, the Tentrem offers everything you would expect in a modern 5 star hotel. It is centrally located, has big pool, spas, restaurants, bars, well trained staff, etc. The food in the restaurant is quite good - I have eaten there both as a guest and an outside visitor - but I just find the scale of it too enormous. It is like being in a large cruise liner restaurant - you almost need roller skates to get from one part to another. And if the restaurant is almost empty - wow, does it feel cavernous.  In my view, this is the problem with the whole hotel - everything is built on a Pharaonic scale - enormous pillars everywhere, huge public spaces, nothing cozy, inviting or warm. I must say in the hotel's favour that that the room we had also was on a…","Positive","AAAOK999",3,"Traveled with family","November 2014"
"Surprisingly great service with a Javanese hospitality made me enjoyed my whole time in this hotel. The breakfast had a lot of choices combined between international food and Javanese food. They also served their signature Tolak Angin ice cream. Nearby small restaurants was also worth to try. Take a short walk to the north then you will find a lamb speciality restaurant. If you continue to walk up north you will find the famous traditional food named 'gudeg' Yu Djum and other Ayam Goreng restaurant. However, the exterior seemed boring with massive construction project around the hotel. But it was okay.","Positive","Ivan V",5,"Traveled with family","November 2014"
"What a great hotel. We knew it was a relatively new hotel when we booked it for our holiday in Sept 2014, so we expected teething problems. However, there were very few issues with the hotel.   Location: Great! Relatively near to shopping areas and temples by car/taxi. It's near a main road so the day can appear chaotic, but once you enter the hotel, it's a vast difference in feeling. Which brings me to the next point...  First impression: Lobby is beautiful, with friendly staff the moment you arrive. Check-in was fast and efficient.   Room: We had the Deluxe Room. And it's bigger than expected. Super comfortable and lovely with great modern amenities (like its Smart TV!). However, our balcony was very dusty, and with my allergies, we stayed away.   Food: To this day, we still…","Positive","cirie_rs",5,"Traveled on business","September 2014"
"Sugeng ndalu (do check out the meaning as u prepare your holiday to Djogja). I'm enthused to write my review even as I'm still at Tentrem. Will be checking out early in the morning.   Booked 1 premier and 1 deluxe room to get connecting rooms via Agoda. So far has always been a fuss-free reservation process.    Although good service is always an expectation from a hotel like Tentrem, this should never be taken for granted by the guests. Hence, two thumbs up to the hotel staff for the wonderful and warm service. Do keep it up. Enjoyed hearing the Javanese greetings of sugeng ndalu, sugeng enjang, etc. even though I don't speak Javanese. Gives a good impression of the importance of preserving the culture of a country and that's what tourists are looking for when they travel.  …","Positive","euphoric16 .",5,"Traveled with family","December 2014"
