"review","sentiment","reviewer","score","type","stay"
"Got red velvet surprised cake during breakfast, while actually in the beginning i did not intend to go for breakfast. It's really a nice cake. Great breakfast too. The hotel service is excellent. Great javanese hospitality...","Positive","Irsan B",5,"Traveled with family","January 2021"
"Had an amazing spa experience assisted by Mbak Hilda! In this pandemic era, my concern on going to spa places was the crowd, but in Gaharu they limit the customer (up to 2 person at a time) but I was lucky to be the only one that night. Mbak Hilda paid attention to every little detail, and make sure I was comfortable. The place itself was really great, I had all the treatments in just one room (except creambath). Will definitely recommend this experience to othersss <U+2728>","Positive","Nabila",5,"Traveled with family","December 2020"
"3 days of relaxing experience in hotel Tentrem. The hotel protocol of handling guess during covid-19 catastrophy is good. We spent a good evening in the executive lounge with excellent service from the staff hotel, Tika and Wahyu.","Positive","Rahmat M",5,"Traveled on business","December 2020"
"Aida - the receptionist - was very friendly and helpful when booking my appointment. Considering I was the last customer, Yunanik gave a very enjoyable and relaxing spa experience. Loved the traditional body scrub (a must try!) and massage.","Positive","Amanda K",5,"Traveled with family","December 2020"
"Arrived in this lovely hotel with my family..... planned to go out for dinner but ended up dining at the hotel instead. Luxurious and cozy ambiance, great service and hospitality.  Thanks to Melina and Aaz.<U+0001F44D>","Positive","ratnasnw",5,"Traveled with family","December 2020"
"Housekeeper mas lutfi dan bayu are so polite and professional in serving us and do thwir daily cleaning. Theyare also friendly and make us feel at home. I am so happy with their services. Stay healthy and happy mas lutfi dan bayu..","Positive","Arifah R",5,"Traveled with family","December 2020"
"Clean Room, Luxury Toilettries, Warm, nice and Humble Poeple, Delicious Food, Amazing facillities. And the very important thing;  there is a minimarket accross the building that open 24 hours. Just in case, you run out of the cigarette in the mid of the night. Hha","Positive","Y. Nugraha",5,"Traveled with family","December 2020"
"Hotel is clean and comfortable, the protocol for covid is also safe, good for staycation, it’s such a great time, the hospitality is on point especially for mba Aulia at sidomuncul gallery excelent service and friendly","Positive","alodia nadifa",5,"Traveled on business","November 2020"
"Services by the staffs at Executive Lounge were great. Thank u Wahyu, Tika, Melina. The food is also good the burrito, wonton etc. The executive suite also great. The receptionist and room attendance were also good","Positive","Titi Kanti Lestari",5,"Traveled with family","November 2020"
"Today (25/11) is my birthday. During my stay in Hotel Tentrem Yogyakarta, we were enjoying the evening in the Executive Lounge.   The hotel staffs, i.e., Tika, Wahyu and Aulia, certainly surprised me. They came with a special birthday tart and song!   It was very surprising and the hotel staffs knew how make the guest happy... Thanks a lot!!","Positive","Abdul Hadi Wijaya",5,"Traveled with family","November 2020"
"Hotel Tentrem has always been my favourite place to stay while in Jogja. The warm welcome always makes me want to return. The staff at the 8th floor lounge, Tika and Wahyu, were exceptionally friendly and helpful. Thumbs up. Breakfast selections are abundance especially the local cuisine, Gudeg, is delicious. Swimming pool is always clear especially during the pandemic - one has to make sure all the safety measurements are taken.  Gym facilities are top notch. The Sauna and the cold pool are perfect match for that Scandinavian style sauna.  So far all boxes are ticked with flying colours! I am hoping to return again to Hotel Tentrem in the bear future.","Positive","Josua Simanjuntak",5,"Traveled with family","November 2020"
"Serve by mr. AAS, good service , very well. We are family, so nice to see mr. AAS, and we of course want to come again to tentrem hotel in Yogjakarta and Semarang . 10 persons of my family so happy to stay here. The food so good, the ambience is so nice.","Positive","Hillarius H",5,"Traveled with family","November 2020"
"I have enjoyed spending my time during afternoon tea snd breskfast with the proffesional service of Tika,Anan and Wahyu. They always offer assistance. I believe the success of Tentrem Hotel lies in the professional staffs. Keep up the good work.","Positive","Riaz Saehu",5,"Traveled on business","November 2020"
"Not a new hotel. But still concerned with their reputation. Very well maintained. Great staffs. Great facilities. I like the breakfast variety menus. Warmest staffs. Helpful. Just feel like home. The location is great too.","Positive","David C",5,"Traveled with family","November 2020"
"Naomi their AFOM and Chef Afif are superb, they are extremely amazing with their best, to give a birth day surprise during our breakfast, naomi asking our stay as their courtesy to make sure we will come back. She is very genuine and funny,  she is listening our experience and note it and very open of critics and opinion,  Well done naomi, meanwhile their DM Aska & Boma try their best to fix our complaint with passion and patience. Natalia FO team and Tika Executive Lounge also Ajeng Restaurant team are vey nice, humble, genuine and fast response. The spa therapist (forgot her name) is very good.  Overall Tentrem always never fail to welcome us back and be our home in beautiful Jogjakarta.  Well done and congratulation Tentrem, you have the best asset of hospitality.  We love…","Positive","Roy W",5,"Traveled with family","November 2020"
"Nice and clean hotel. We're very satisfied with the outstanding service and meticulous Covid-19 protocol have very strict.  very recommended for family, the playground is big... located in the heart of yogyakarta.. staff so friendly. sure will go back next time..","Positive","Yuli V",5,"Traveled with family","November 2020"
"Good service by Melina and Aaz <U+0001F44D> Keep up the good and creative work and variations of food and beverages. My first time of trying different type of food and beverages contains Tolak angin, surprisingly taste good!","Positive","Blossom L",5,"Traveled with family","November 2020"
"I have lived in 6 different countries and have travelled a large amount of the world on either business and/or personal travel which has resulted in a lot of hotels stays. I currently live in Jakarta and been there for 2 years now and I was not disappointed the last time I stayed at Hotel Tentrem and once again I have received stellar service this time around. From the welcoming on arrival to the food, gym, executive lounge, and room, it was a great experience. I am not one to single out staff members as you have all excelled in your professional approach, welcoming kind nature, and can do attitude to make all guests feel special, but I did however receive superior service from Rizky who works in the Eboni Bar and Lounge. Please pass on my thanks to Rizky, as it was very much…","Positive","Simon",5,"Traveled on business","November 2020"
"Highly refommended.. very nice place.. food was good.. I would stay here again.. service was good as well with mas Aan and mba Melina..both excelent service and friendly staff  <U+0001F44D><U+0001F3FB><U+0001F44D><U+0001F3FB><U+0001F44D><U+0001F3FB><U+0001F44D><U+0001F3FB><U+0001F44D><U+0001F3FB>  Good luck tentrem yogyakarta!","Positive","Nindya Hadiwodjojo",5,"Traveled with family","November 2020"
"We had a very good massage, Hidla, Muyas and Icha took care of all details to make us feel real luxury experience from recepcion to the treatment. Massage techniques were very professional, you can see they are well trained for that, and very important, they respect the time for the massage!, something that seems difficult in other places.","Positive","MarieC",5,"Traveled with family","November 2020"
"full body massage by Hilda and Yanti. me and my friend got the full body Javanese Massage. It was a very relaxing, I even slept during the massage. best relaxing massage we ever had in a while. thank you","Positive","mabel",5,"Traveled with family","November 2020"
"Everything is excellent, you have to check the drawer inside the room, under the TV Set all your need is there, including ""TOLAK ANGIN"" .   The Gaharu Spa also giving you good service, all member of my family try the gaharu Spa at Lower Ground. Thanks to Hilda, Icha, Maria, Yuna and Yani whom done their job well.","Positive","Andi Laurencius",5,"Traveled with family","October 2020"
"second experience @tentrem still peaceful n uniq, breakfast so nusantara with 'tolak angin' ice cream, do not forget to get wet in pool, last but not least, excellent serve@tentrem hotel jogja lounge 8th fl, thx mr wahyu n mr. anan..cu next #hope cov 19 immediatly gone & Godbless Indonesia!","Positive","mamat syaban",5,"Traveled on business","November 2020"
"I stayed with my family at Tentrem Hotel for the long weekend. Excellent rooms, clean and spacious. The food was also excellent. One dinner I had at the Kayumanis brings out excellent food and also excellent service from Mr. Zayn. Would recommend easily","Positive","Dominic B",5,"Traveled with family","November 2020"
"The taste of food so delicious.. I recommend oxtail grill soup & fish n chips for kids menu..!! like the ambience too.. so Cozy & full of music.. Thanks to Ms Rizky & Meisi already give good service to us.. <U+263A><U+FE0F>","Positive","Risma Nur A",4,"Traveled with family","October 2020"
"First time stay at Hotel Tentrem Yogyakarta and first experience with Tentrem Hotel group. Excellent Service provided by staff members of the Hotel, especially by I. Setyabudi for F&B matters & Aaz for services in the executive lounge. Memorable Tranquil Holiday time with Family in Yogyakarta. Excellent Nasi Gudeg too! ","Positive","Randy Nangoy",5,"Traveled with family","October 2020"
"Very nice Hotel. Nice Room. Nice Food. And have a nice pool and gym! All of staff also very nice. And I really have the Best Massage in Gaharu Spa with Mba Hilda!  I will massage and stay here again for next staycation <U+2764><U+FE0F><U+2764><U+FE0F><U+2764><U+FE0F><U+2764><U+FE0F><U+2764><U+FE0F><U+2764><U+FE0F><U+2764><U+FE0F><U+2764><U+FE0F><U+2764><U+FE0F><U+2764><U+FE0F><U+2764><U+FE0F><U+2764><U+FE0F><U+2764><U+FE0F><U+2764><U+FE0F>  ","Positive","Falicia",5,"Traveled with family","October 2020"
"Have a birthday dinner at Kayu Manis Resto, love the ambiance and food, especially the roasted and peking duck. Nice service and good for price. I really recommend the place if you visiting Yogyakarta. Thank you Chef Habib and service team :)","Positive","LAD",5,"Traveled on business","October 2020"
"Frozen beer nya gokiiiiiiiiilllllll Pelayanan yg RUARRR BIASAAAAA Thanks a lot for Mr Edi dengan welcome home drink nya ;) Thanks a lot to Mr Oki untuk keramahtamahan nya and Thanks to all Eboni staff untuk setiap sambutannya yang hangat.. CHEEERRSSS EBONI","Positive","David Ps",5,"Traveled with family","October 2020"
"A good venue to hang out and chill with friends. The foods are good, well served and well taste. The waitress (Mba Dewi) is so polite, friendly and very helpful. Also during pandemic, covid protocol was well applied so that all customers will feel secure.","Positive","Datuk W",5,"Traveled with family","October 2020"
"We visited Hotel Tentrem in Oct 2020 while the world was still afraid of COVID-19. I have to admit, the hotel took all possible precautions to keep its guest and staff safe. One example being, disinfecting the room with a spray several times a day even while the guests were in the room. They also had temp checks, hand sanitisers etc and a limited amount of guest were allowed to dine at one given time. What we loved most was its proximity to the bustling city and also the convenience of having smaller hotels and food stalls on the roadside which helped us accommodate the needs of our driver & maid. The staff were beyond amazing. Very friendly, hospitable and chatty, if you're up for a chat. Meisi from F &B was 1 girl that stood out from the crowd, with her extra sweet nature and…","Positive","Nidhi Fernandez",5,"Traveled with family","October 2020"
"tempat breakfast rapi, bersih,  dan taat protokol. jadi makan aman dan nyaman. staf ramah.  feel glad to choose this hotel. Hahah I was surprised with every single thing happened. But yeah, thanks to those two guys and for the whole hotel staffs for making my staying experience became awesome and unforgettable. Cheers!","Positive","Nofa D",5,"Traveled with family","October 2020"
"Tentrem Hotel has always been our little family staying choice in Jogjakarta..Thank you for the hospitality..especially for today.. Daddy's suprise birthday party & cake from the hotel crew..To : Executive Assistant Manager,Mr.Irman,Melina, Ferri & Wildan..thanks a bunch! <U+0001F60A> See you next month!","Positive","Dinny",5,"Traveled on business","October 2020"
"I have never been feeling really comfortable and appreciated by all the hotel staffs before I experienced staying and chilling in Tentrem Hotel YK. I've travelled around the world and explored numerous hotels before, but this hotel actually serves the best and the most polite service. Nonetheless, the one simple thing that made me feel appreciated was when I had my breakfast in Kayumanis restaurant (inside Tentrem Hotel), I ordered iced cappuccino but unfortunately, based on the basic regulation, it's only allowed to order hot coffees. However, I would like to say thank you and I totally appreciate Mr. William dan Mr. Novan who totally understand my young soul who likes iced coffee and cold things more than anything else by surprisingly brought 2 glasses of iced cappuccino and 1…","Positive","Nabila S",5,"Traveled with family","September 2020"
"tempat breakfast rapi, bersih, safe dan taat protokol. jadi makan aman dan nyaman  the croissant is my favorite.  staf ramah dan sangat helpful <U+0001F970>  feel glad to choose this hotel. thank you so much   staff: selvia","Positive","nisma b",5,"Traveled with family","September 2020"
"The service here is nice, and the employees are really easygoing. Their speciality here is the roasted duck and their fried rice. I recommend ordering half a duck instead of a full duck as it is quite filling. Overall, it is a great place to eat and has even better food.","Positive","Jason T",5,"Traveled with family","September 2020"
"Itu mbak nya yg silvia kerjanya bagus ! Well done. The food is good and clean. The jamu traditional is also good. I love to stay in tentrem yogyakarta. The room also excellent and the employees are friendly. Recommended !","Positive","Yogi soesanto",5,"Traveled with family","September 2020"
"Excellent prime location, beautiful hotel with great art pieces decoration. Complete and modern in-room amenities. Provide high level of sanitation procedures and amenities. But what i like the most, is the staff. They're so genuine, polite and helpful. Friendly but yet still giving enough room for your personal space.  Ps: also thumbs up for great job done by Chef Alif and team :)","Positive","poly_only",4,"Traveled on business","September 2020"
"We were there in the beginning of pandemic covid19. The hotel has ready with standard health protocol (thermal check and hand sanitizers) The room was so so. The lobby ambience was nice. there re many unique spots for taking photos. I love the staff’s uniform, looking elegant and professional tho","Positive","Sang Ayutu Parashita",5,"Traveled with family","March 2020"
"My family have visited this hotel multiple times and are always satisfied with their services. Especially during this pandemic, they kept cleanliness for the hotel rooms & restaurant. One of the restaurant waiter, Mas Andika, was very nice and helpful, he also provided us with top service always asked us for what we need & want.","Positive","regi",5,"Traveled with family","September 2020"
"The room was spacious, just enough for a family consisting of 4 person. The big is huge, sleeping ameneties were 5 stars quality as expected. But the breeakfast was so-so. During Covid-19 the buffett was served but guests cannot take the food by themselves. Staffs were helping them to serve the food. We didn't try the swimming pool, but the gym was also great and have luxury vibes.","Positive","NatashaIskandar",5,"Traveled with family","August 2020"
"Good implemetation of social distancing and safety protocol.<U+0001F44D><U+0001F3FB><U+0001F44D><U+0001F3FB> Food was great, nice staff.  Good place to stay. Room was ok can improve on sound insulation especially. Reception was ok. Lastly thank you for birthday cake <U+0001F600><U+0001F600><U+0001F600>","Positive","Arfindi B",5,"Traveled with family","August 2020"
"The Hotel is very good and peace confortable expecialy the food n the kayu manis we like so many kinds of Jamu We thanks for Mr Habib who serve us very good nice and polite and bring so many kinds of food. We love to Stay here.","Positive","Gloria P",5,"Traveled on business","August 2020"
"Tentrem Hotel Yogyakarta, one of the most prestigious and well known 5 Stars hotel in Yogyakarta. Owned by the conglomerate family of SidoMuncul, Tolak Angin is easy to find when you are staying in this hotel.   Beautiful Hotel Lobby, Excellent Gym area and equipments, Great Swimming Pool, and Very Spacious Hotel Room. You’ll get a 200x200cm size for a Double Bed Deluxe Room. Love it!   Breakfast was delicious. Wide variety from local to international cuisines here. Don’t forget to try their Nasi Liwet stall, Single Origin filter coffee, and of course Tolak Angin Ice Cream. Best!","Positive","Vincent Christanto",5,"Traveled with family","August 2020"
"Hotel Tentrem is the first hotel we visited during this pandemic and the health protocol implemented here is beyond my expectation! Hand washing facilities are available on the basement (parking area) entrance and the main entrance, hand sanitizers are everywhere, I even got a ‘corona finger’ upon check-in.  I got a really warm welcome upon check in with Ms. Astrid & Mrs. Natalie, they explained all the hotel facilities and the health protocol here detail and impressive. They even grant my early check in request and I got my room ready once I arrived here. Room is spacious and cleaned. Towels, hotel slippers, and glasses are wrapped in plastic. Mrs. Frizka in batik and jamu outlet in lobby is really welcoming and attentively answered all my question. Pool attendants were all…","Positive","Carolina E",5,"Traveled with family","August 2020"
"Love this hotel, clean room and comfortable, also great location, would definitely recommend and would certainly stay here again. Thanks for the compliment of our anniversary yesterday. WE enjoyed our stay at your hotel.","Positive","LUCY",5,"Traveled with family","August 2020"
"A very pleasant and comfortable experience stay during the time of covid. Health protocol is well maintained. Room cleaning and service is excellent. Social distancing in Kayu Manis restaurant during breakfast is well implemented. Special shout out to mr irwan at Kayu Manis for a good hospitality","Positive","Bella p",4,"Traveled with family","August 2020"
"The ethnic java with modern styles you will be feel in this 5 stars hotel in yogyakarta . The hotel is a clean and tidy even in a public restroom . For a welcome drink you will feels the taste of herbal drink from indonesia ( we are calling JAMU ) they provide also in a buffet breakfast and special ice cream herbal ( in this hotel only - tolak angin ice cream ) they have swimming pools for kids as well and playground for the kids . ","Positive","Ferdi Prasetya",5,"Traveled on business","August 2020"
"Kind of modern and traditional concept in one design, quite nice in term of building quality as 5 Star hotel and known as one of the best 5 star hotel in Yogya, my conclusion: -	room was convenience, quite big and well decorated for standard room, I love the room. -	Swimming pool was average, less resort feels, but still okay for business trip. -	Kids Club was superb! The best in Indonesia (maybe?), truly large and suit for family with kids -	 I like the welcome drink! the taste was on point, could reflect Indonesian  -	Breakfast was average, but their Tolak Angin ice cream was big deal, must try list. - gym and sauna was okay for 5 star hotel I hope the hotel always keep their building quality at the highest standard, because when I looked around from the balcony, I saw brown…","Positive","traveloque",5,"Traveled with family","February 2020"
"Great services from the staff! Thanks for bringing the joy to us. Great cake, great food, great service! And I got compliment cake too from them. This restaurant applied all health protocols, so we don't have to be worry","Positive","Reza Ryan",5,"Traveled with family","August 2020"
"Nice and clean room, breakfast was busy, but well managed with many choices of food.the single origin coffee were exquisite. Very helpful and friendly staff. (especially) William).The pool was awesome. Totally well spent staycation.<U+0001F44D><U+0001F44D>","Positive","Ronny A",5,"Traveled with family","August 2020"
"Very good service and especially during this time of pandemic situation hotel maintains excellent protocol.  Will recommend this hotel for staycation.  Restaurant kayu manis is really good and have tasty breakfast menu. Staffs maintain great protocols and service of food and beverages were excellent.","Positive","Syed Hameed",5,"Traveled with family","July 2020"
"Very good service during the time of covid, they maintain the protocol and adviced to stay here during the new normal and during regular days.  Very good and adviced to stay here. They have an excellent Swimming Pool and Gym facilities.  Room is clean and room service is excellent.","Positive","Fitriana M",5,"Traveled on business","July 2020"
"This was my second visit to this hotel after many months ago, and it did not disappoint. The hotel itself had all the services you'd expect from the 5 stars. The checkin was easy, they'd confirm the housekeeping time to make sure it will fit your schedule nicely. The sense of elegance and everything is so pleasing to the eye. Staffs were polite kind and they seemed to genuinely care for our every need. Breakfast was amazing!!! Special mention to mrs naomi, natalia and joana who were so lovely, i am very impressed by the service, theyre so helpful, eager to assist. ","Positive","martin5",5,"Traveled with family","July 2020"
"We stayed in the executive suite floor and had the best experience in the executive lounge with the friendliest help from Ms Tika. Would totaly recommend it to anyone who’s going to stay in Jogjakarta. A little extra splurge for the suite goes a long long way, definitely worth it!","Positive","Aditya N",5,"Traveled with family","July 2020"
"This hotel is very comfortable and worth at cost. Nice place to stay either for business or family vacation. The large room makes our stay more comfortable. Very recommended 5 stars hotel in Jogjakarta","Positive","Arie K",5,"Traveled with family","June 2020"
"one of the best hotel and serves the best bakeries in jogja. good hospitality. everyone did a very good job. i enjoyed staying here.   the bar is cozy too.  everything’s affordable for a 5 star hotel!!!!","Positive","Nash H",5,"Traveled with family","June 2020"
"Thank you for mas william for being really attentive. Impeccable service. The restaurant service still the same as the first time i visited long time ago. The tolak angin ice cream is a must to try, a very unique experience really. Thank you Tentrem and Kayu Manis","Positive","Martin S",5,"Traveled on business","June 2020"
"I always be here for any kind purposes. So much happy with all the service and treatment and facilities..  also, loveeee shopping Gallery Sido Muncul... never fail to satisfy my happiness <U+0001F60D><U+0001F60D><U+0001F60D>  At Resto Kayu Manis... Mas William, serving us in such a Beautiful polite One!!! Happy so much...  Thank youuuuu Tentrem... You are the star of the hospitality industry <U+0001F970><U+0001F970><U+0001F970><U+0001F339><U+0001F339><U+0001F339><U+2764><U+FE0F><U+2764><U+FE0F><U+2764><U+FE0F>","Positive","Maya R",5,"Traveled with family","June 2020"
"One of the best place to stay when you visiting Yogyakarta, friendly and helpful staffs, tasty food in the restaurant, room not too big but clean and comfy. Amazing health facilities, they provide spacious fitness center and sauna. Overall that was enjoyable moment.","Positive","R_Wido",4,"Traveled with family","March 2020"
"Wow we went to train and have a swim today and after all that I ordered my usual coffee but as I have been complaing about the size of the coffee previously OKTA made a great coffee for me and I think its the best in Jogjakarta without a doubt.Thank you OKTA for making this great coffee.You make the best and I will continue to visit the pool bar with all of my friends also.Once again great work OKTA and thanks.","Positive","garryjessop",5,"Traveled with family","May 2020"
"The hotel is huge with traditional touch. Lemon grass fragrance is my fav. Special thanks to Ms.Mikha at the front desk who introduce me to a local drink ""jamu"" and give me some recommended places during my stay and the man at the pool bar who is very nice and friendly.","Positive","Dragonnest",5,"Traveled with family","February 2020"
